1755:1755	and military technological cooperation is constantly being broadened and promoted between the two sides .	N/A	military technology cooperation between the two sides is being continuously increased .	N/A	1	1	1-0 2-1 3-2 4-7 5-9 6-8 10-3 11-4 12-5 13-6 14-11 7-10 8-10 9-10		 
1756:1756	the council stated in a press communique that the air strikes " will only lead to an increase in the shaking of stability in the region " .	N/A	in a press conference , the council said that the air strikes " will only lead to destabilizing the region " .	N/A	1	1	0-5 1-6 2-7 3-0 4-1 5-2 6-3 7-8 8-9 9-10 10-11 11-12 12-13 13-14 14-15 15-16 16-17 17-17 18-17 19-17 20-17 21-17 22-17 23-18 24-18 25-19 26-20 27-21		 
1757:1757	when he was three years old he had a high fever and suffered paralysis to his legs and he was accepted to the children 's welfare institution .	N/A	at 3 , he contracted infantile paralysis because of a high fever , and an orphanage adopted him that year .	N/A	1	1	3-1 4-1 5-1 6-3 8-9 9-10 10-11 12-4 13-6 17-13 18-17 19-16 20-16 23-15 24-15 25-15 26-15 27-20 0-0 1-0 2-0 7-7 7-8 22-14		 
1758:1758	the province registered a trade deficit with taiwan amounting to 2.53 billion american dollars in the year 2003 , with an increase of 1.89 percent , compared with the preceding year .	N/A	the province recorded a trade deficit with taiwan of 2.53 billion american dollars in 2003 , up 1.89 % from the previous year .	N/A	1	1	0-0 1-1 2-2 3-3 4-4 5-5 6-6 7-7 8-8 9-8 10-9 11-10 12-11 13-12 14-13 15-14 16-14 17-14 18-15 19-16 20-16 21-16 22-16 23-17 24-18 26-19 27-19 28-20 29-21 30-22 31-23		 
1759:1759	according to the report , anxious passengers robbed keys of the guard of the crossways and opened the door of guardrails .	N/A	the report said anxious passengers grabbed the key from a guard and opened the crossing rail .	N/A	1	1	0-0 0-1 0-2 1-0 1-1 1-2 2-0 2-1 2-2 3-0 3-1 3-2 5-3 6-4 7-5 8-6 8-7 9-8 10-9 11-10 15-11 16-12 17-13 18-14 18-15 19-14 19-15 20-14 20-15 21-16		 
1760:1760	the worst affected areas include worcestershire , gloucestershire , warwickshire and nine other areas .	N/A	worst hit areas included worcestshire , gloucetsershire , yorkshire and others .	N/A	1	1	0-0 1-0 2-1 3-2 4-3 5-4 6-5 7-6 8-7 9-8 10-9 11-10 12-10 13-10 14-11		 
1761:1761	the palestinians need to slow down in order to reach the safe shores of the arab initiative .	N/A	palestinians need to be patient to reach the coast of the arab initiative .	N/A	1	1	0-0 1-0 2-1 3-2 6-5 7-5 8-5 9-6 10-7 11-8 12-8 13-9 14-10 15-11 16-12 17-13 4-3 4-4 5-3 5-4		 
1762:1762	he said that the 83-year-old woman was frightened and received treatment at a hospital nearby .	N/A	he said the 83-year-old woman has been hospitalized for over-shock .	N/A	1	1	0-0 1-1 3-2 4-3 5-4 7-9 9-7 10-7 11-7 12-7 13-7 15-10 6-5 6-6		 
1763:1763	he stressed , the return of those destitute and homeless people to their homes in the country was an urgent problem .	N/A	he stressed sending the refugees around the country back home is an imperative issue .	N/A	1	1	0-0 1-1 3-3 11-8 13-9 14-5 15-6 16-7 17-10 18-11 19-12 20-13 21-14 4-2 5-2 6-4 7-4 8-4 9-4 10-4		 
1764:1764	the dai yu xiang industrial consulting company said that spacious front door area is the biggest characteristic of yunnan gardens with land ownership .	N/A	dai yuxiang industry consulting company said that the most unique characteristic of yunnan gardens is its wide facade .	N/A	1	1	1-0 2-1 3-1 4-2 5-3 6-4 7-5 8-6 9-16 10-17 11-17 12-17 13-14 14-7 15-8 15-9 16-10 17-11 18-12 19-13 23-18 8-15		 
1765:1765	- to continue introducing and recommending hong kong as a center of legal service and dispute mediation .	N/A	- to further promote hong kong as a legal service and dispute resolution center .	N/A	1	1	0-0 1-1 2-2 3-3 4-3 5-3 6-4 7-5 8-6 9-7 10-13 12-8 13-9 14-10 15-11 16-12 17-14		 
1766:1766	boeing company and the israeli company iai elta are competing for the award in the project whose cost is 1.7 billion dollars .	N/A	boeing and the israeli company iai elta are competing to win the 1.7 million dollar project .	N/A	1	1	0-0 1-0 2-1 3-2 4-3 5-4 6-5 7-6 8-7 9-8 14-11 15-15 19-12 21-14 22-16 10-9 11-10 12-10 20-13		 
1767:1767	arafat also confirmed that the palestinian side was totally committed to the promises made .	N/A	arafat also stressed that the palestinian side would keep its promises .	N/A	1	1	0-0 1-1 2-2 3-3 4-4 5-5 6-6 9-8 10-8 11-9 12-10 14-11 7-7		 
1768:1768	he also met with losada , president of the argentine house of representatives .	N/A	he also met argentina 's lower house speaker camano .	N/A	1	1	0-0 1-1 2-2 3-2 7-4 8-3 9-3 10-6 13-9 4-7 4-8 10-5 11-5 11-6 12-5 12-6		 
1769:1769	" now there still exist many problems and the political process in cambodia is under way . "	N/A	there are many problems ; cambodia 's political progress is still going on .	N/A	1	1	2-0 5-2 6-3 9-7 10-8 11-6 12-5 13-9 14-10 14-11 14-12 15-10 15-11 15-12 16-13 3-1 4-1 7-4		 
1770:1770	those who own satellite dishes may watch the programmes of the satellite channels .	N/A	those who own satellite dishes can watch the satellite channels .	N/A	1	1	0-0 1-1 2-2 3-3 4-4 5-5 6-6 10-7 11-8 12-9 13-10		 
1771:1771	it has become urgent now to raise the awareness of all citizens and to spread information about this disease and the way to prevent and cure it .	N/A	it is urgent that all citizens become aware and that information be shared on ways to prevent and treat this ailment .	N/A	1	1	0-0 3-2 6-6 6-7 7-6 7-7 8-6 8-7 9-6 9-7 10-4 11-5 12-8 14-11 14-12 15-10 16-13 17-19 18-20 20-14 21-14 22-15 23-16 24-17 25-18 27-21 1-1 2-1 5-3 26-19 26-20		 
1772:1772	schuster and his entourage arrived in shanghai for a visit from beijing on a charter plane at the noon of the 8th .	N/A	schuster and his party arrived in shanghai from beijing in private plane on the 8th at noon .	N/A	1	1	0-0 1-1 2-2 3-3 4-4 5-5 6-6 10-7 11-8 12-9 13-10 14-10 15-11 16-12 17-13 18-16 20-13 21-14 22-17		 
1773:1773	keizo obuchi made a statement saying that the iraq 's cooperation following the resumption of the arms inspection program is " insufficient . "	N/A	koizumi made announcements that after restoration of weapon inspection , iraq " did n't give enough " cooperation .	N/A	1	1	0-0 1-0 2-1 3-2 4-2 5-2 6-3 8-10 10-17 11-4 12-5 13-5 14-6 15-7 16-7 17-8 19-12 19-13 19-14 19-15 20-11 21-12 21-13 21-14 21-15 22-18 23-16		 
1774:1774	the agency added that it was planned that preparatory meetings at the level of experts the day after tomorrow , monday , would precede the business of the conference and continue for two days .	N/A	the agency added that a two-day preliminary meeting at the expert level will be held after tomorrow , monday , before the conference .	N/A	1	1	0-0 1-1 2-2 3-3 5-12 5-13 5-14 6-12 6-13 6-14 8-6 9-7 10-8 11-9 12-11 14-10 17-15 18-16 19-17 20-18 21-19 23-20 27-21 28-22 31-5 32-5 33-5 34-23		 
1775:1775	israeli radio said the israeli army was pursuing an activist from the popular front for the liberation of palestine .	N/A	israeli public radio reported that the israeli army was pursuing the pflp activist .	N/A	1	1	0-0 1-2 2-3 2-4 3-5 4-6 5-7 6-8 7-9 8-10 9-12 11-11 12-11 13-11 14-11 15-11 16-11 17-11 18-11 19-13		 
1776:1776	taib is currently attending an international alumni conference in the city of adelaide .	N/A	taib is attending an international alumnus meeting in adelaide now .	N/A	1	1	0-0 1-1 2-9 3-2 4-3 5-4 6-5 7-6 8-7 9-8 10-8 11-8 12-8 13-10		 
1777:1777	he further stressed that , " we are contemplating what else can be done and how we can turn all these into systems . "	N/A	he also emphasized : " we are considering what else we can do and how to systematize these . "	N/A	1	1	0-0 1-1 2-2 3-2 5-4 6-5 7-6 8-7 9-8 10-9 11-11 12-12 13-12 14-13 15-14 18-16 20-17 21-16 22-16 23-18 24-19 4-3		 
1778:1778	silva is a member of portuguese right wing party , populist party .	N/A	shever is a member of portugese right-wing party .	N/A	1	1	1-1 2-2 3-3 4-4 5-5 6-6 7-6 8-7 12-8 0-0 10-6 11-7		 
1779:1779	in the midst of this crisis , the first wedding ceremony in bam since the disaster occurred was performed on wednesday , according to what the public radio reported .	N/A	in the midst of this disaster the first marriage was held since the catastrophe , according to the public broadcasting .	N/A	1	1	0-0 1-1 2-2 3-3 4-4 5-5 7-6 8-7 9-8 10-8 13-11 14-12 15-13 17-9 18-10 21-14 22-15 23-16 25-17 26-18 27-19 28-19 29-20		 
1780:1780	tang yiau-ming also met with two senior officials of the us government at that time .	N/A	tang yiau-ming also met with two senior us officials at the time .	N/A	1	1	0-0 1-1 2-2 3-3 4-4 5-5 6-6 7-8 9-7 10-7 11-7 12-9 13-10 14-11 15-12		 
1781:1781	navy helicopters dispatched from the us aircraft carrier " the lincoln " have been on their mission to drop relief supplies and pick up survivors in the indonesian province of aceh for a second day .	N/A	a fleet of us navy helicopters from the us aircraft carrier lincoln dropped aid and picked up survivors for a second day in aceh of indonesia .	N/A	1	1	0-4 1-5 2-6 3-6 4-7 5-8 6-9 7-10 9-11 10-11 18-12 19-13 20-13 21-14 22-15 23-16 24-17 25-22 26-25 27-25 28-25 29-24 30-23 31-18 32-19 33-20 34-21 35-26 8-11 11-11		 
1782:1782	the export profit in foreign currency of the whole year was 400 million us dollars , while import was 250 million us dollars .	N/A	its annual export volume reached us $ 400 million and import volume us $ 250 million .	N/A	1	1	0-0 1-2 2-3 3-3 4-3 5-3 7-1 8-1 9-1 10-4 11-7 12-8 13-5 14-6 16-9 17-10 17-11 19-14 20-15 21-12 22-13 23-16		 
1783:1783	earlier , peres had arrived in uruguay on friday .	N/A	peres arrived in uruguay , friday .	N/A	1	1	2-0 4-1 5-2 6-3 7-5 8-5 9-6 3-1		 
1784:1784	he added , " communication between the government and the leaders of the movements has not been broken off . we are familiar with the issues they are thinking about . "	N/A	he added that " communication between the government and the movement 's leaders has not stopped ; we know their concerns . "	N/A	1	1	0-0 1-1 1-2 3-3 4-4 5-5 6-6 7-7 8-8 9-12 10-12 11-11 12-9 13-10 14-13 15-14 16-15 17-15 18-15 19-16 20-17 21-18 22-18 23-18 24-19 24-20 25-19 25-20 26-19 26-20 27-19 27-20 28-19 28-20 29-19 29-20 30-21 31-22		 
1785:1785	i hope that various kinds of chinese troupes can often come to turkey to give their performances to help the turkish people learn more about the chinese culture . "	N/A	i hope that different kinds of troupes can come and perform in turkey such that we can understand the chinese culture better . "	N/A	1	1	0-0 1-1 2-2 3-3 4-4 5-5 7-6 8-7 10-8 11-11 12-12 14-10 15-10 16-10 22-17 25-18 26-19 27-20 28-22 29-23 17-14 20-15 21-15 23-21 24-21		 
1786:1786	reevlin thought that the world economy has not freed itself totally from the crisis yet .	N/A	riphlen considered the world was not completely free from crisis so far ,	N/A	1	1	1-1 2-1 3-2 4-3 7-5 8-7 10-6 11-8 12-9 13-9 14-10 14-11 15-12 0-0 6-4		 
1787:1787	hunter said that the association conducted the survey in brisbane and found that one quarter of the british people believe that the local australians discriminate against them .	N/A	hantel said the survey by the association found that one quarter of the british believe that they are discriminated against in australia .	N/A	1	1	0-0 1-1 3-5 4-6 6-2 7-3 11-7 12-8 13-9 14-10 15-11 16-12 17-13 18-13 19-14 20-15 24-17 24-18 25-19 27-22 2-1 5-4 8-20 9-21 21-16 22-16 23-16		 
1788:1788	on wednesday , five procurators of british house of lord began to hold a hearing on the appeal for the adjudication made by a lower court .	N/A	on wednesday a five-member panel of british law lords began a hearing on an appeal from a lower divisional court .	N/A	1	1	0-0 1-1 3-3 4-4 5-5 6-6 7-7 8-7 9-8 10-9 13-10 14-11 15-12 16-13 17-14 18-14 19-14 20-14 21-15 22-15 23-16 24-17 24-18 25-19 26-20		 
1789:1789	this smaller than expected number of protestors gathered outside of the kremlin in moscow , many people also waved communist flags .	N/A	a small of number of demonstrators gathered outside the kremlin , waving communist party flags .	N/A	1	1	0-0 1-1 2-1 3-1 4-3 5-4 6-5 7-6 8-7 10-8 11-9 12-9 13-9 14-10 18-11 19-12 19-13 20-14 21-15 15-5 16-5		 
1790:1790	the project will benefit about 410,000 people in the jincheng area .	N/A	some 410,000 people in the jincheng area will benefit .	N/A	1	1	2-7 3-8 4-0 5-1 6-2 7-3 8-4 9-5 10-6 11-9		 
1791:1791	somewhat smaller enterprises will be managed by local government .	N/A	local governments will manage the smaller enterprises .	N/A	1	1	1-5 2-6 3-2 4-3 5-3 6-3 7-0 8-1 9-7		 
1792:1792	they are being admitted to the hospital because of simple diseases . "	N/A	and are being hospitalized for minor illnesses . "	N/A	1	1	1-1 2-2 3-3 4-3 5-3 6-3 7-4 8-4 9-5 10-6 11-7 12-8		 
1793:1793	news agencies stated that a military unit comprising five thousand soldiers dispatched by president gloria bacabajal oreo has driven the rebels into the depth of the middle forests of basilan . / end of news /	N/A	it is reported that president gloria makayagal had sent a 5000 men military unit which drove the rebels far inside the jungles of basilan.-end of the story-	N/A	1	1	2-2 3-3 4-9 5-12 6-13 8-10 9-10 10-11 11-8 12-8 13-4 14-5 15-6 16-6 18-15 19-16 20-17 21-18 21-19 22-18 22-19 23-18 23-19 24-18 24-19 25-20 26-21 27-21 28-22 29-23 32-23 33-24 34-25 34-26 0-0 1-0 31-23 35-26		 
1794:1794	president clinton himself has made important and valuable contributions to the development of the sino-u.s. relations , and we will never forget the contributions he has made .	N/A	president clinton has made valuable contributions to the development of sino-american relations and we will never forget that .	N/A	1	1	0-0 1-1 3-2 4-3 5-4 6-4 7-4 8-5 9-6 10-7 11-8 12-9 13-10 14-10 15-11 17-12 18-13 19-14 20-15 21-16 27-18 22-17 23-17 24-17 25-17 26-17		 
1795:1795	these countries were for a large part affected by the low prices of their major export products .	N/A	most of these countries are affected by the low price for primary exports .	N/A	1	1	0-2 1-3 2-4 4-0 4-1 5-0 5-1 6-0 6-1 7-5 8-6 9-7 10-8 11-9 12-10 14-11 15-12 16-12 17-13		 
1796:1796	turin winter olympic games unveiled , and both north and south korean delegations marched into the stadium together while holding hands	N/A	north , south korean representatives enter stadium together hand in hand at opening of turin winter olympics	N/A	1	1	0-14 1-15 2-16 3-16 8-0 9-1 10-2 11-3 12-4 13-5 14-5 15-6 16-6 17-7 18-8 18-9 18-10 19-8 19-9 19-10 20-8 20-9 20-10 4-11 4-12 4-13		 
1797:1797	it is estimated that the amount of import and export trade for the entire year will exceed us $ 9 billion .	N/A	it is anticipated that the annual total foreign trade volume will exceed us $ 9 billion .	N/A	1	1	0-0 1-1 2-2 3-3 4-4 5-9 7-7 7-8 8-7 8-8 9-7 9-8 10-7 10-8 12-5 13-5 14-5 15-10 16-11 17-12 18-13 19-14 20-15 21-16		 
1798:1798	" i think we have talked about this many times . in this area , we have to pay special attention to and ensure that the taiwan problem is properly dealt with " .	N/A	" i think we have mentioned many times that we should pay more attention to how to solve the issue of taiwan .	N/A	1	1	0-0 1-1 2-2 3-3 4-4 5-5 6-5 8-6 9-7 15-9 16-10 17-10 18-11 20-13 21-14 25-18 26-19 26-20 26-21 27-19 27-20 27-21 29-17 30-17 31-17 33-22 19-12		 
1799:1799	- the anti-taliban northern alliance forces organized a military parade that included 40 russian-made tanks .	N/A	anti-taliban northern alliance forces held a military parade with 40 russian-made tanks .	N/A	1	1	1-0 2-0 3-1 4-2 5-3 6-4 7-5 8-6 9-7 12-9 13-10 14-11 15-12 10-8 11-8		 
1800:1800	the agency added that the conference meetings are to be preceded by preparatory meetings at the level of experts the day after tomorrow , monday , and will last for two days .	N/A	the agency added that preliminary meetings of experts will take place the day after tomorrow , monday , ahead of the conference .	N/A	1	1	0-0 1-1 2-2 3-3 4-20 5-21 6-21 10-18 10-19 11-18 11-19 12-4 13-5 17-6 18-7 19-11 20-12 21-13 22-14 23-15 24-16 25-17 32-22 7-8 8-8 9-8		 
1801:1801	the plane coming from jeddah will carry libyan pilgrims to their country and will pass through egyptian airspace on thursday .	N/A	the flight coming from jeddah will take home the libyan pilgrims using egyptian airspace .	N/A	1	1	0-0 1-1 2-2 3-3 4-4 5-5 6-6 7-8 7-9 8-10 9-7 10-7 11-7 15-11 16-12 17-13 20-14		 
1802:1802	the capital from the top ten countries and regions accounts for more than 91 % of the total amount of nationally utilized foreign capital .	N/A	these top ten covers over 91 % of all the practically utilized foreign investment in china .	N/A	1	1	3-0 4-1 5-2 9-3 10-3 11-4 12-4 13-5 14-6 15-7 16-9 21-11 22-12 23-13 24-16 17-8 18-8 19-8 20-14 20-15		 
1803:1803	by the end of this year , production and installation of all equipment will have finished .	N/A	all the equipments will be produced and installed within this year .	N/A	1	1	0-8 1-8 2-8 3-8 4-9 5-10 7-5 8-6 9-7 11-0 12-1 12-2 13-3 16-11		 
1804:1804	of which , the amount of exports reached 30.8 billion us dollars , and the amount of imports reached 29.18 billion us dollars .	N/A	of the total volume , export totaled us $ 30.88 billion while import amounted to us $ 29.18 billion .	N/A	1	1	0-0 1-0 2-4 3-1 4-2 4-3 6-5 7-6 8-9 9-10 10-7 11-8 13-11 17-12 18-13 18-14 19-17 20-18 21-15 22-16 23-19		 
1805:1805	he emphasized that it is only through stronger unification can one defeat any attempt to split zimbabwe .	N/A	he emphasized that only unity could beat any attempt to divide zinbarbwe .	N/A	1	1	0-0 1-1 2-2 5-3 8-4 9-5 11-6 12-7 13-8 14-9 15-10 16-11 17-12		 
1806:1806	a confirmation of whether a person has contracted the bird flu virus can be obtained in as little as an hour by testing a specimen from the suspected carrier with this rapid diagnostic method .	N/A	using this quick testing method to test a suspected case specimen can produce a conclusion about bird flu infection in as fast as one hour .	N/A	1	1	0-13 1-14 2-15 9-16 10-17 12-11 15-19 16-20 17-21 18-22 19-23 20-24 21-5 22-6 23-7 24-10 27-8 28-9 29-0 30-1 31-2 32-3 33-4 34-25 13-12 14-12 8-16		 
1807:1807	hamid ridha asfa , spokesperson for the iranian foreign ministry , rejected saddam 's declarations , describing them as being " unfounded and racist . "	N/A	iranian foreign ministry spokesman , hamed riza rejected saddam 's statements and described them as " baseless and racist . "	N/A	1	1	0-5 1-6 2-6 4-3 6-0 7-0 8-1 9-2 10-4 11-7 12-8 13-9 14-10 16-12 17-13 18-14 20-15 21-16 22-17 23-18 24-19 25-20 15-11		 
1808:1808	the turkish law enforcement authorities have the rights to arrest , sentence and jail them .	N/A	the turkish jurisdiction is entitled to arrest , sentence and detain them .	N/A	1	1	0-0 1-1 2-2 3-2 4-2 5-3 6-4 7-4 8-5 9-6 10-7 11-8 12-9 13-10 14-11 15-12		 
1809:1809	the organization that conducted this public-opinion poll is the social science research center of hong kong university .	N/A	social sciences research centre , university of hong kong conducted the survey .	N/A	1	1	3-9 4-10 5-11 6-11 9-0 10-1 11-2 12-3 13-6 14-7 15-8 16-5 17-12		 
1810:1810	president akaev spoke highly of the achievements of his talk with premier li peng .	N/A	akaev spoke highly of his meeting with premier li peng .	N/A	1	1	0-0 1-0 2-1 3-2 4-3 8-4 9-5 10-6 11-7 12-8 13-9 14-10		 
1811:1811	he indicated that the two mummies had been found in the area of ghor al-safi in the province close to the eastern bank of the dead sea .	N/A	he explained that they found the two mummies in the ghor al-safi region near the eastern coast of the dead sea .	N/A	1	1	0-0 1-1 2-2 3-5 4-6 5-7 8-4 9-8 10-9 11-12 12-12 13-10 14-11 18-13 19-13 20-14 21-15 22-16 23-17 24-18 25-19 26-20 27-21		 
1812:1812	this is the first representative office that holland trade promoting commission has set up in china .	N/A	this is the first representative office of the association in china .	N/A	1	1	0-0 1-1 2-2 3-3 4-4 5-5 8-8 9-8 10-8 14-9 15-10 16-11		 
1813:1813	both parties held discussion on specific related problems and reached unanimous agreement on a wide range of issues .	N/A	the two parties exchanged views on concrete issues concerned and reached wide range agreement .	N/A	1	1	0-0 0-1 1-2 2-3 2-4 3-3 3-4 4-5 5-6 6-8 7-7 8-9 9-10 11-13 12-11 12-12 13-11 13-12 14-11 14-12 15-11 15-12 16-11 16-12 18-14		 
1814:1814	moore said : " we had a frank discussion about the east timor issue and other related matters .	N/A	moore said : " we discussed frankly on east timor and other relative issues .	N/A	1	1	0-0 1-1 2-2 3-3 4-4 5-5 5-6 6-5 6-6 7-5 7-6 8-5 8-6 9-7 10-8 11-8 12-9 13-9 14-10 15-11 16-12 17-13 18-14		 
1815:1815	after the signing ceremony , president arkayev and premier li peng answered questions respectively asked by reporters .	N/A	after the signing ceremonym president akaev and premier li peng answered questions of reporters .	N/A	1	1	0-0 1-1 2-2 3-3 5-4 6-5 7-6 8-7 9-8 10-9 11-10 12-11 15-12 16-13 17-14		 
1816:1816	and that it is extremely important to gain the support of pakistan at this stage .	N/A	pakistan 's cooperation is vital at the present time . "	N/A	1	1	3-3 4-4 5-4 8-2 9-2 10-1 11-0 12-5 13-6 14-7 14-8 15-9		 
1817:1817	he knows that the pakistanis love this man more than they love him .	N/A	he knows that pakistanis love this man more than him .	N/A	1	1	0-0 1-1 2-2 3-3 4-3 5-4 6-5 7-6 8-7 9-8 11-4 12-9 13-10		 
1818:1818	the construction project of beihai harbor conveyance system made use of us $ 10 million loan from korean government .	N/A	beihai port conveyance project using us $ 10 million of south korean government loan	N/A	1	1	2-3 4-0 5-1 6-2 8-4 9-4 10-4 11-5 12-6 13-7 14-8 15-13 16-9 17-10 17-11 18-12 19-13		 
1819:1819	the report of the standing committee of npc has received 2587 yes-votes , 112 no-votes and 114 abstentions in yesterday 's voting .	N/A	the report of the npc standing committee received 2,587 votes in favor , 112 against and 114 abstentions .	N/A	1	1	0-0 1-1 2-2 3-3 4-5 5-6 7-4 9-7 10-8 11-9 11-10 11-11 12-12 13-13 14-14 15-15 16-16 17-17 22-18		 
1820:1820	the index would fall 3.9 % if the sales of vehicles were not included .	N/A	and 3.9 % down if automobile sales is not counted .	N/A	1	1	3-3 4-1 5-2 6-4 7-6 8-6 10-5 11-7 12-8 13-9 14-10		 
1821:1821	japan , on the other hand , supports containment and deterrence . other countries also consider the strategy of containment and deterrence acceptable under certain circumstances .	N/A	japan supports containment . other countries also believe that under certain circumstance , the policy of containment is acceptable .	N/A	1	1	0-0 7-1 8-2 11-3 12-4 13-5 14-6 15-7 15-8 16-13 17-14 18-15 19-16 22-18 23-9 24-10 25-11 26-19		 
1822:1822	the winner received three gold medals from the local authorities of the tourism sector .	N/A	the winner received three gold medals from the local tourism officers .	N/A	1	1	0-0 1-1 2-2 3-3 4-4 5-5 6-6 7-7 8-8 9-10 10-9 11-9 12-9 13-9 14-11		 
1823:1823	the foreign ministry of france said that because of his refusal to cooperate with the united nations , the iraqi leader has brought about this tragic consequence .	N/A	the french foreign ministry said that because iraqi leader refuses to cooperate with the un caused this sad events .	N/A	1	1	0-0 1-2 2-3 3-1 4-1 5-4 6-5 7-6 10-9 11-10 12-11 13-12 14-13 15-14 16-14 18-7 19-7 20-8 22-15 23-15 24-16 25-17 26-18 27-19		 
1824:1824	however , if he is found guilty on the charges , he should be punished just like any other malaysian citizen " .	N/A	" but if he is guilty he should be punished like other malaysian citizens . "	N/A	1	1	0-1 2-2 3-3 4-4 5-5 6-5 11-6 12-7 13-8 14-9 15-10 16-10 17-11 18-11 19-12 20-13 21-15 22-14		 
1825:1825	he considered the case to have taken " unnecessarily and ridiculously long " , and gave reassurances that egypt was making continuous efforts with all the parties to find a solution	N/A	he opined that the issue had prolonged and terminated . he added that egypt was continuing its efforts to find a solution .	N/A	1	1	0-0 1-1 1-2 2-3 3-4 5-5 13-9 15-11 16-11 17-12 18-13 19-14 20-15 21-15 22-17 27-18 28-19 29-20 30-21 6-6 7-6 8-6 9-6 10-6 11-6 12-6		 
1826:1826	the department of justice has already entered into co-operation agreements with the justice bureaus of beijing and shanghai etc .	N/A	so far the department of justice has signed cooperation agreements with beijing and shanghai .	N/A	1	1	0-2 1-3 2-4 3-5 4-6 6-7 7-7 8-8 9-9 10-10 15-11 16-12 17-13 19-14		 
1827:1827	the letter added : " those who attempt to protect those extremists share with them the same sin . "	N/A	it added : " whoever tries to protect extremists will share in their guilt " .	N/A	1	1	2-1 3-2 4-3 5-4 6-4 7-5 8-6 9-7 11-8 12-10 13-11 14-12 15-13 16-13 17-13 18-15 19-14 0-0 1-0		 
1828:1828	it is estimated that the hearing will last for two days .	N/A	the hearing is expected to last two days .	N/A	1	1	1-2 2-3 4-0 5-1 7-5 8-5 9-6 10-7 11-8 6-4		 
1829:1829	putin reached brussels on monday to hold discussions which will last three days with its belgian hosts , leaders of the european union and nato . / end of the news item / 1	N/A	putin arrived in brussels on monday to hold talks for 3 days with his belgian hosts and leaders of the european union and nato .	N/A	1	1	0-0 1-1 1-2 2-3 3-4 4-5 5-6 6-7 7-8 11-10 12-11 13-12 14-13 15-14 16-15 17-16 18-17 19-18 20-19 21-20 22-21 23-22 24-23 25-24 8-9 9-9 10-9		 
1830:1830	sinai gaza 2 october / chinkhoi / the palestinian leadership declared this evening its denunciation and condemnation of the operation that occurred at elie sinai settlement in the northern part of the gaza strip .	N/A	sinai gaza october 2 / xinhua palestinian leadership denounced this evening the attack on the jewish settlement of eli sinai north of gaza strip .	N/A	1	1	0-0 1-1 2-3 3-2 4-4 5-5 6-4 7-6 8-6 9-7 10-8 11-9 12-10 18-11 19-12 20-13 23-18 24-19 25-16 26-20 27-20 28-20 29-20 30-21 31-22 32-22 33-23 34-24		 
