1168:1168	he said : " the law is just and fair ; if he is innocent , i believe he will be released .	N/A	" the laws are fair . ... if he is innocent , i believe he will be freed .	N/A	1	1	3-0 4-1 5-2 6-3 7-4 8-4 9-4 11-7 12-8 13-9 14-10 15-11 16-12 17-13 18-14 19-15 20-16 21-17 22-18 10-6		 
1169:1169	the two guests also communicated on a broad range of issues regarding the new military uniforms with net buddies , which include items , styles , sizes and wearing .	N/A	the two guests also held extensive exchanges with netizens in the types , styles , sizes , and wearing of the new army uniforms .	N/A	1	1	0-0 1-1 2-2 3-3 4-4 4-6 5-5 6-5 7-5 8-5 9-5 12-20 13-21 14-22 15-23 16-7 17-8 18-8 22-10 22-11 23-12 24-13 25-14 26-15 27-17 28-18 29-24 11-19 20-9 21-9		 
1170:1170	guo expressed his satisfaction with respect to the principled , committed position of russia , which respects the one-china policy with regard to the question of taiwan .	N/A	guo expressed his satisfaction with the principled and committed russian position , at one with chinese policy on the taiwan question .	N/A	1	1	0-0 1-1 2-2 3-3 4-4 5-4 6-4 7-5 8-6 10-8 11-10 12-9 13-9 14-11 15-12 15-13 15-14 16-12 16-13 16-14 17-15 18-15 19-16 20-17 21-17 22-17 23-18 24-20 25-19 26-19 27-21 9-7		 
1171:1171	he also said : " our contestants had not adapted themselves to having the contest under strong sunlight " .	N/A	he further said : " our players are not accustomed to contests under strong sunlight .	N/A	1	1	0-0 1-1 2-2 3-3 4-4 5-5 6-6 8-8 9-9 10-9 11-10 12-11 13-11 14-11 15-12 16-13 17-14 19-15 7-7		 
1172:1172	he said that compared with the ways of violence and stirring up internal strife , it 's more effective to choose an intellectual way to express yourselves .	N/A	he said , to express one 's wishes through rational means would be more effective than resorting to violence and disturbances .	N/A	1	1	0-0 1-1 3-15 4-15 5-16 5-17 6-16 6-17 7-16 7-17 8-18 9-19 12-20 13-20 16-12 17-13 18-14 22-9 23-10 24-3 25-4 27-21 2-2 19-8 20-8 26-5 26-6 26-7		 
1173:1173	the leader of the house of representatives rote expressed that , the house of representatives will be able to conduct a fair trail based on the current evidence .	N/A	the senate majority party leader lott indicated that the senate would make a fair judgment based on existing evidences .	N/A	1	1	0-0 1-4 3-1 3-2 3-3 4-1 4-2 4-3 5-1 5-2 5-3 6-1 6-2 6-3 7-5 8-6 9-7 11-8 12-9 13-9 14-9 15-10 16-10 17-10 18-10 19-11 20-12 21-13 22-14 23-15 24-16 25-17 26-17 27-18 28-19		 
1174:1174	however , peace in the south represents a strong motive to drive forward negotiations between the khartoum government and rebel movements in darfur .	N/A	peace in the south is believed to give momentum to negotiations between khartoum and darfur rebels .	N/A	1	1	2-0 3-1 4-2 5-3 13-10 14-11 15-12 16-12 17-12 18-13 19-15 21-14 22-14 23-16 6-4 6-5 6-6 7-7 7-8 7-9 8-7 8-8 8-9 9-7 9-8 9-9 10-7 10-8 10-9 11-7 11-8 11-9 12-7 12-8 12-9 20-15		 
1175:1175	a report by the indian newspaper industry trust of the indian communications co. says that railroad officials blame passengers on the bus for the incident .	N/A	tulas news reported that the railway official blamed the passengers of the bus for causing the accident .	N/A	1	1	13-2 14-3 15-4 15-5 16-6 17-7 18-8 18-9 19-10 20-11 21-12 22-13 23-15 24-16 25-17 4-1 5-1 6-1 7-1 9-0 10-0 11-0 12-0 22-14		 
1176:1176	he urged that the united states maintain a clear notion of the peace in the middle east and play its due role in this so that the un resolutions can be actually implemented .	N/A	he called for us to make clear its views on mideast peace and play its role to ensure related us resolutions be enforced .	N/A	1	1	0-0 1-1 1-2 2-1 2-2 3-3 4-3 5-3 6-5 6-6 7-5 7-6 8-5 8-6 9-8 10-9 11-11 12-11 14-10 15-10 16-10 17-12 18-13 19-14 21-15 28-20 30-21 32-22 33-23 24-16 24-17 25-16 25-17		 
1177:1177	dean has made the anti-iraq war as a major topic in his election campaign .	N/A	dean has put his election focus on opposing the iraq war .	N/A	1	1	0-0 1-1 2-2 3-8 4-9 5-10 6-5 7-5 8-5 9-5 11-3 12-4 13-4 14-11		 
1178:1178	the wide-based index , which includes 100 shares , decreased by 21.25 points over the previous day , in which it closed at 1301.2 points , to reach 1280.03 points . / end of news /	N/A	the broad-based index of 100 shares also fell ; at 1280.03 , it was 21.25 points down from the previous day 's 1301 . 2.end of article	N/A	1	1	0-0 1-1 2-2 4-3 5-3 6-4 7-5 9-7 9-16 10-16 11-14 12-15 13-17 14-18 15-19 16-20 23-22 24-22 26-9 27-9 28-10 29-10 30-23 32-24 33-25 34-26 21-21 22-21 31-24		 
1179:1179	russian legislator expresses his concerns and urges keeping calm about the controversy surrounding the cartoons	N/A	russian legislator expresses his concern and urges calm regarding controversy over cartoons	N/A	1	1	0-0 1-1 2-2 3-3 4-4 5-5 6-6 7-7 8-7 9-8 10-9 11-9 12-10 13-11 14-11		 
1180:1180	as the reform of state-run industries advances , more stock-issuing enterprises will be going abroad to get listed ; hong kong will be the first choice for state-run industries to obtain foreign listings .	N/A	with the deepening reform of state-owned enterprises , more and more share-holding companies are to be listed in the stock market outside mainland .	N/A	1	1	0-0 1-1 2-3 3-4 4-5 5-6 7-7 8-8 8-9 8-10 9-11 10-12 15-14 16-15 17-16 33-23 11-13 12-13 13-13 14-21 14-22		 
1181:1181	wang , a member of the central military committee , said that the peoples of china and chile enjoyed a long history of friendship despite the geographical distance between the two countries	N/A	the two peoples of china and chile have old friendly relations despite the geographic distance between the two countries , wang said .	N/A	1	1	0-20 10-21 12-0 13-1 13-2 14-3 15-4 16-5 17-6 18-7 19-8 20-8 21-8 22-8 23-9 23-10 24-11 25-12 26-13 27-14 28-15 29-16 30-17 31-18		 
1182:1182	the two leaders decided to cooperate in the investigation to uncover the cause of the crash .	N/A	the two leaders agreed to cooperate in determining the cause of the tragedy .	N/A	1	1	0-0 1-1 2-2 3-3 4-4 5-5 6-6 9-7 10-7 11-8 12-9 13-10 14-11 15-12 16-13		 
1183:1183	enterprises with foreign investment helped fuel the growth of trades with japan .	N/A	foreign funded venture trade with japan grew rapidly ,	N/A	1	1	0-2 2-0 3-1 5-6 5-7 6-6 6-7 7-6 7-7 8-6 8-7 9-3 10-4 11-5 12-8		 
1184:1184	gaza international airport was put into operation the day before .	N/A	the airport began operations one day before .	N/A	1	1	2-0 2-1 3-2 4-2 5-2 6-3 8-5 9-6 10-7 7-4		 
1185:1185	the head of the yemenite public investment agency director , his excellency abdul karim mteir , announced that today , saturday .	N/A	saada abdul karim mutair , head of yemeni general investment board , revealed this information today .	N/A	1	1	0-5 1-5 2-6 3-7 4-7 5-8 6-9 7-10 9-4 12-0 12-1 13-2 14-3 16-12 17-13 18-15 21-16		 
1186:1186	the statement said that both of them were seized during the war by the chinese soldiers near the border between south korea and north korea in the northeast area .	N/A	the statement says that the two were captured in the northeast region adjacent to the border by chinese soldiers .	N/A	1	1	0-0 1-1 2-2 3-3 4-4 4-5 7-6 8-7 12-16 13-17 14-17 15-18 16-12 16-13 17-14 18-15 25-8 26-9 27-10 28-11 29-19		 
1187:1187	eczema is a common form of allergy in babies younger than one year of age .	N/A	eczema is normally seen in boys less than 1 year old .	N/A	1	1	0-0 1-1 2-2 2-3 3-2 3-3 4-2 4-3 7-4 8-5 9-6 10-7 11-8 12-9 13-10 14-10 15-11		 
1188:1188	according to statistics , there are currently in jiangsu province more than 100 agricultural and sideline products processing enterprises with production value of over 100 million yuan .	N/A	statistics show that more than 100 enterprises in jiangsu that produce processed agricultural products have output values of over rmb 100 million .	N/A	1	1	0-1 1-1 2-0 7-7 8-8 9-8 10-3 11-4 12-5 13-12 16-13 20-15 21-16 22-17 23-18 24-20 25-21 26-19 27-22 17-9 17-10 19-14		 
1189:1189	milosevic explained , " we refuse to accept that the territory division plan is only a part of the peace plan of bosnia and herzegovina " .	N/A	krajisnik , in his talk further stressed that " the rejected territory plan is only part of the peace plan ,	N/A	1	1	0-0 3-8 5-10 6-10 7-10 8-10 9-9 10-11 11-11 12-12 13-13 14-14 15-15 16-15 17-16 18-17 19-18 20-19 26-20 1-2 1-3 1-4 1-5 1-6 1-7		 
1190:1190	these adverse reactions range from minor one of having blisters to serious one of sudden death from heart attack .	N/A	these adverse reactions were as minor as blistering and as major as sudden cardiac death .	N/A	1	1	0-0 1-1 2-2 5-4 5-5 5-6 8-7 9-7 11-9 11-10 11-11 14-12 15-14 16-13 17-13 18-13 19-15		 
1191:1191	he said , " we deployed the necessary individuals in the rural areas and throughout the observation centers on the regional level . "	N/A	he said , " we deployed the necessary observers in rural areas through control centers in all regions . "	N/A	1	1	0-0 1-1 2-2 3-3 4-4 5-5 6-6 7-7 8-8 9-9 10-10 11-10 12-11 14-12 15-13 16-13 17-14 18-15 19-16 20-17 21-17 22-18 23-19		 
1192:1192	the session 's meetings came within the context of the continuing bilateral co-operation between the two countries .	N/A	the session meetings fall within the framework of mutual cooperation between the two countries .	N/A	1	1	0-0 1-1 2-1 3-2 4-3 5-4 6-5 7-6 8-7 11-8 12-9 13-10 14-11 15-12 16-13 17-14		 
1193:1193	in a970 , nobel laurate lance pauling recommended the use of 1000 milligram of food daily to prevent cold .	N/A	winner of 1970 nobel prize layence pauling suggested 1000 mg diet daily to avoid cold .	N/A	1	1	1-2 3-3 4-4 5-5 6-6 7-7 11-8 12-9 14-10 15-11 16-12 17-13 18-14 19-15 0-1		 
1194:1194	lamy said : " the member states will not be completely satisfied with the details of the suggestions , but at present the problems causing differences are fewer than the problems of reaching agreement . "	N/A	lamy said , " members will not be fully satisfied with the texts . but what separates members today is smaller than what unites them . "	N/A	1	1	0-0 1-1 2-2 3-3 4-4 5-4 6-4 7-5 8-6 9-7 10-8 11-9 12-10 13-11 18-13 19-14 26-19 27-20 28-21 34-25 35-26 14-12 15-12 16-12 17-12 20-18 21-18 22-15 22-16 22-17 23-15 23-16 23-17 24-15 24-16 24-17 25-15 25-16 25-17 29-22 29-23 29-24 30-22 30-23 30-24 31-22 31-23 31-24 32-22 32-23 32-24 33-22 33-23 33-24		 
1195:1195	in a statement issued today , the presidency stated that the secretary general of the organization of francophone countries , butrus butrus ghali , informed president emile lahoud of this in a telephone conversation .	N/A	the presidence said in a statement issued today that francophone secretary general butrous butrous ghali informed president emil lahoud of the matter by phone .	N/A	1	1	0-3 1-4 2-5 3-6 4-7 6-0 7-1 8-2 9-8 10-10 11-10 12-11 17-9 20-12 21-13 22-14 24-15 25-16 26-17 27-18 28-19 30-22 30-23 31-22 31-23 32-22 32-23 33-22 33-23 34-24 29-20 29-21		 
1196:1196	fuchs , another prosecutor , said that kalina also agreed to pay 70,000 us dollars to settle a civil lawsuit against him by the us securities and exchange commission .	N/A	another prosecutor fox said that kalina also agreed to pay 70,000 us dollars to settle a civil complaint raised by us securities exchange .	N/A	1	1	0-2 2-0 3-1 5-3 6-4 7-5 8-6 9-7 10-8 11-9 12-10 13-11 14-12 15-13 16-14 17-15 18-16 19-17 22-18 22-19 24-20 25-21 25-22 26-21 26-22 27-21 27-22 28-21 28-22 29-23		 
1197:1197	the other three accused persons were sentenced to set terms of imprisonment for their actions in the rule of terror described by people in the prison camp .	N/A	the other three defendants were sentenced to prison terms for their roles in what people said the cruel rule in the camp .	N/A	1	1	0-0 1-1 2-2 3-3 4-3 5-4 6-5 7-6 8-7 8-8 9-7 9-8 10-7 10-8 11-7 11-8 12-9 13-10 14-11 15-12 16-16 17-18 19-17 20-13 20-14 20-15 21-13 21-14 21-15 22-13 22-14 22-15 23-19 24-20 25-21 26-21 27-22 18-17		 
1198:1198	if coal mines with high concentrations of methane do not implement " ventilation first , mining second , " they will be ordered to immediately stop production in accordance with the law .	N/A	if high gassy mines fail to " drain gas before mining coal " , they will be legally ordered to immediately halt production .	N/A	1	1	0-0 1-3 2-3 4-1 5-1 6-1 7-2 8-4 8-5 9-4 9-5 11-6 12-7 12-8 13-9 15-10 17-13 18-12 19-14 20-15 21-16 22-18 23-19 24-20 25-21 26-22 27-17 28-17 29-17 30-17 31-17 32-23		 
1199:1199	the seminar is jointly organized by the shanghai research center of the world trade organization and shanghai foreign service co . ltd. and will last for two days .	N/A	the two-day forum is jointly sponsored by wto shanghai research center and foreign service co . ltd. of shanghai .	N/A	1	1	0-0 1-2 2-3 3-4 4-5 5-6 6-8 7-8 8-9 9-10 10-7 11-7 12-7 13-7 14-7 15-11 16-17 16-18 17-12 18-13 19-14 20-15 21-16 24-1 25-1 26-1 27-1 28-19		 
1200:1200	a spokesman for the bus company concerned said : " the suicide combatant set off the bomb he carried in the rear part of the bus .	N/A	spokesman of concerned bus company said , " the suicide bomber exploded the bomb at the back of the bus . "	N/A	1	1	0-0 1-0 2-1 3-3 4-3 5-4 6-2 7-5 8-6 9-7 10-8 11-9 12-10 13-11 14-11 15-12 16-13 19-14 20-15 21-16 22-16 23-17 24-18 25-19 26-20 17-13 18-13		 
1201:1201	leaders of countries such as peru and bolivia have all reduced their own salaries .	N/A	leaders of peru and bolivia both cut their own salaries .	N/A	1	1	0-0 1-1 5-2 6-3 7-4 9-5 10-6 11-7 12-8 13-9 14-10		 
1202:1202	he had been dipping into the nuclear black market for a long while .	N/A	he had long swum in the nuclear black market .	N/A	1	1	0-0 1-1 4-4 5-5 6-6 7-7 8-8 9-2 10-2 11-2 12-2 13-9 2-3 3-3		 
1203:1203	but the foreign extremists are misusing the traditional generosity of the afghan people .	N/A	but foreign extremists are badly using the generosity of afghani people	N/A	1	1	0-0 1-1 2-1 3-2 4-3 5-4 5-5 6-6 8-7 9-8 10-9 11-9 12-10		 
1204:1204	the statement said , " the european union finds that , according to the security council 's resolution number 1368 , that the american response is legitimate . "	N/A	" eu considers the us retaliation legal and in accordance with un resolution number 1368 " , the statement said .	N/A	1	1	0-17 1-18 2-19 4-0 5-1 6-1 7-1 8-2 11-8 11-9 11-10 12-8 12-9 12-10 17-12 18-13 19-14 22-3 23-4 24-5 25-6 26-6 27-20 28-15		 
1205:1205	a spokesman of the us embassy in tokyo has confirmed that this was the first time that washington openly supported japan 's campaign for building iter in the country .	N/A	a spokesman of u.s. embassy in tokyo confirmed it was the first time that washington publicly supported the construction of iter in japan .	N/A	1	1	0-0 1-1 2-2 3-3 4-3 5-4 6-5 7-6 9-7 11-8 12-9 13-10 14-11 15-12 16-13 17-14 18-15 19-16 23-19 24-17 24-18 25-20 26-21 29-23 8-7 27-22 28-22		 
1206:1206	the development of the first two parcels is expected to be completed by march , 2000 .	N/A	the first two locations are estimated to be finished by march , 2000 .	N/A	1	1	3-0 4-1 5-2 6-3 7-4 8-5 9-6 10-7 11-8 12-9 13-10 14-11 15-12 16-13		 
1207:1207	the operation required the connection of 6 blood vessels , and 510 stitches with needles . the distance between stitch points did not exceed 3 mm .	N/A	the surgery involved anastomoses of six blood vessels , with more than 510 stitches no more than 3 millimeters apart .	N/A	1	1	0-0 1-1 2-2 3-3 4-3 5-4 6-5 7-6 8-7 9-8 10-9 11-12 12-13 21-14 21-15 21-16 22-14 22-15 22-16 23-14 23-15 23-16 24-17 25-18 26-20 16-19 17-19 18-19 19-19 20-19		 
1208:1208	the seminar will last for two days , and will be held jointly by the wto shanghai research center and shanghai foreign service co . , ltd .	N/A	the 2 days ' seminar is jointly hosted by the wto shanghai study center and shanghai foreign service co . ltd .	N/A	1	1	0-0 1-4 5-1 6-2 11-7 12-6 13-8 14-9 15-10 16-11 17-12 18-13 19-14 20-15 21-16 22-17 23-18 24-19 26-20 27-21 9-5 10-5		 
1209:1209	he has also won the world championship seven times .	N/A	he has also won seven world championships .	N/A	1	1	0-0 1-1 2-2 3-3 4-5 5-5 6-6 7-4 8-4 9-7		 
1210:1210	he firmly believes that canada and china can become very good partners in cooperation .	N/A	he thought canada and china could become very good partners .	N/A	1	1	0-0 2-1 3-1 4-2 5-3 6-4 7-5 8-6 9-7 10-8 11-9 12-9 13-9 14-10		 
1211:1211	according to the commission , most of these countries selected to raise interest rates to protect their currencies .	N/A	the committee said most countries chose to raise interest rates to protect their currencies .	N/A	1	1	0-2 1-2 2-0 3-1 5-3 6-3 8-4 9-5 10-6 11-7 12-8 13-9 14-10 15-11 16-12 17-13 18-14		 
1212:1212	according to marchi , human rights and social justice should be made important contents in canada 's foreign trade policy .	N/A	the human right and social justice should be an important part in canadian foreign trade policy .	N/A	1	1	4-0 4-1 5-2 6-3 7-4 8-5 9-6 10-7 11-8 12-9 13-10 14-11 15-12 16-12 17-13 18-14 19-15 20-16		 
1213:1213	and that it is extremely important to gain the support of pakistan at this stage .	N/A	it is of highly importance to invest pakistan 's cooperation , now ?	N/A	1	1	2-0 3-1 4-2 4-3 4-4 5-2 5-3 5-4 6-5 7-6 8-9 9-9 10-8 11-7 12-11 13-11 14-11 15-12		 
1214:1214	he said that a japanese delegation is currently visiting the united states to learn first hand how the united states is preventing the mad cow disease .	N/A	he said that the japanese delegation was visiting the usa to study the measures taken to prevent the mad cow disease .	N/A	1	1	0-0 1-1 2-2 3-3 4-4 5-5 8-7 9-8 10-9 11-9 12-10 13-11 14-11 15-11 21-16 22-17 23-18 24-19 25-20 26-21 6-6 7-6 16-12 16-13 16-14 16-15 17-12 17-13 17-14 17-15 18-12 18-13 18-14 18-15 19-12 19-13 19-14 19-15 20-12 20-13 20-14 20-15		 
1215:1215	by virtue of the first decree , foreign minister farouk al-shara was appointed as " vice president in charge of implementing foreign affairs and media policies . "	N/A	according to the first decree , farouq al-shara has been appointed " vice president for foreign and media affairs " .	N/A	1	1	0-0 0-1 1-0 1-1 2-0 2-1 3-2 4-3 5-4 6-5 9-6 10-7 12-10 13-10 14-11 15-12 16-13 21-15 22-18 23-16 24-17 26-20 27-19 11-8 11-9 17-14 18-14 19-14 20-14		 
1216:1216	the american economy only increased by 3.3 % for the third quarter , and it 's lower than the first quarter , which was 5.5 % .	N/A	u.s. third quarter growth is 3.3 % , which is lower than the 5.5 % recorded in first quarter .	N/A	1	1	0-0 1-0 6-5 7-6 9-1 10-1 11-2 12-7 15-9 16-10 17-11 18-12 19-17 20-18 24-13 25-14 26-19 4-3 5-4 14-8 22-15 23-15		 
1217:1217	according to specialist 's judgment , there could be a great number of dinosaur bone fossils and fossils of other species in this dinosaur fossil concentrated area .	N/A	according to the researchers predictions they expect to find more vertebrae and other animal bones in this area .	N/A	1	1	0-0 1-1 4-4 9-9 10-9 11-9 12-9 14-10 15-10 16-11 17-12 17-13 17-14 18-12 18-13 18-14 19-12 19-13 19-14 20-12 20-13 20-14 21-15 22-16 26-17 27-18 2-2 2-3 3-2 3-3 6-5 6-6 6-7 6-8 7-5 7-6 7-7 7-8 8-5 8-6 8-7 8-8 13-10		 
1218:1218	at that time , cambodia 's joining of asean was just a visionary hope plan mainly because hun sun overthrew prince ranariddh by force .	N/A	cambodia 's failure to join asean was due to the overthrow of prince ranariddh by hun sen.	N/A	1	1	4-0 5-1 8-5 15-6 15-7 15-8 16-6 16-7 16-8 17-15 18-16 19-9 19-10 19-11 20-12 21-13 6-2 6-3 6-4 7-2 7-3 7-4 9-2 9-3 9-4 10-2 10-3 10-4 11-2 11-3 11-4 12-2 12-3 12-4 13-2 13-3 13-4 14-2 14-3 14-4 24-16		 
1219:1219	he stated that it will be possible for companies operating in the e-commerce sector to settle and establish offices , employ staff and own equipment in the area open to companies fully owned by foreigners .	N/A	he said fully foriegn-owned companies that deal with e-commerce can settlein the free zone , have offices , hire staff and own equipment .	N/A	1	1	0-0 1-1 2-1 8-4 9-5 9-6 9-7 10-5 10-6 10-7 11-8 12-8 13-8 15-10 17-15 18-16 19-17 20-18 21-19 22-20 23-21 24-22 26-11 27-13 31-2 32-3 33-3 34-3 35-23 4-9 5-9 6-9 7-9 16-14 28-12 29-12 30-12		 
1220:1220	more than ten countries in the world such as the united states , canada and japan have sailing festivals .	N/A	a dozen countries including the us , canada and japan , also have navigation festivals .	N/A	1	1	0-0 0-1 1-0 1-1 2-0 2-1 3-2 4-2 5-2 6-2 7-3 8-3 9-4 10-5 11-5 12-6 13-7 14-8 15-9 16-12 17-13 18-14 19-15		 
1221:1221	he took part in the first round of 6-party talks held in beijing in august last year .	N/A	he attended the first round of talks in beijing in august last year .	N/A	1	1	0-0 1-1 2-1 3-1 4-2 5-3 6-4 7-5 9-6 10-7 11-7 12-8 13-9 14-10 15-11 16-12 17-13 8-6		 
1222:1222	the netherlands , which holds the european union 's rotating presidency , made the above remark after the eu-china summit .	N/A	the netherlands , the eu rotating presidency , made the above statement after the sino-eu summit .	N/A	1	1	0-0 1-1 2-2 5-3 6-4 7-4 8-4 9-5 10-6 11-7 12-8 13-9 14-10 15-11 16-12 17-13 18-14 19-15 20-16		 
1223:1223	through negotiations , the colombian government and the " united self-defense forces of colombia " reached a peaceful disbandment agreement this june .	N/A	in june this year , the colombian government and the auc reached a peaceful demobilization agreement following negotiations .	N/A	1	1	0-16 1-17 2-4 3-5 4-6 5-7 6-8 7-9 8-10 9-10 10-10 11-10 12-10 13-10 14-10 15-11 16-12 17-13 18-14 19-15 20-2 20-3 21-1 22-18		 
1224:1224	but instead of taking any money , the man grabbed the women by the neck and tried to kill her .	N/A	however , the man did not take any money but tried to strangle her .	N/A	1	1	0-0 1-4 1-5 2-4 2-5 3-6 4-7 5-8 7-2 8-3 16-10 17-11 18-12 19-13 20-14		 
1225:1225	it should be noted that the state situated in south asia was a strong ally of the taliban regime in afghanistan , which openly supports bin laden .	N/A	the south asian country was a strong ally of the taliban , who openly support bin laden , in afghanistan .	N/A	1	1	9-0 9-1 10-2 11-4 12-5 13-6 14-7 15-8 16-9 17-10 19-18 20-19 21-11 22-12 23-13 24-14 25-15 26-16 27-20 10-3		 
1226:1226	he added that israel has " all the means to defend itself , and has an especially strong retaliatory force "	N/A	he added that israel has means to defend itself and possesses a deterrent force .	N/A	1	1	0-0 1-1 2-2 3-3 4-4 6-5 7-5 8-5 9-6 10-7 11-8 13-9 14-10 15-11 16-12 17-12 18-12 19-13 20-14		 
1227:1227	the middle east news agency reported that officials expect " the preparation work will continue until july and political action will be taken afterwards . "	N/A	mena said officials expect " preparations will continue into july and then be followed by political actions . "	N/A	1	1	0-0 1-0 2-0 3-0 4-0 5-1 6-1 7-2 8-3 9-4 10-5 11-5 12-5 13-6 14-7 15-8 16-9 17-10 18-15 19-16 21-12 24-17 25-18 22-13 22-14 23-11		 
1228:1228	he is currently preparing to make a recording of the complete works of schumann for piano in chronological order .	N/A	he is currently preparing to record chopin 's entire works for piano in chronological order .	N/A	1	1	0-0 1-1 2-2 3-3 4-4 5-5 6-5 7-5 8-5 9-8 10-8 11-9 12-7 13-6 14-10 15-11 16-12 17-13 18-14 19-15		 
1229:1229	to all of our listeners , now let 's take a look at the situation in china .	N/A	dear listeners , let 's take a look at the situation in china .	N/A	1	1	4-1 5-2 7-3 8-4 9-5 10-6 11-7 12-8 13-9 14-10 15-11 16-12 17-13 0-0 1-0 2-0 3-0		 
1230:1230	the plane crash upon landing had occurred at 14:20 , local time / 20:11 gmt , when the plane experienced mechanical malfunction .	N/A	the plane crash happened at 14:20 local time / 20:11 gmt because of mechanical failure .	N/A	1	1	0-0 1-1 2-2 6-3 7-4 8-5 10-6 11-7 12-8 13-9 14-10 20-13 21-14 22-15 16-11 16-12		 
1231:1231	changes in al-atri 's cabinet and al-shara , vice president , commissioned to oversee foreign affairs	N/A	changes in al-utri 's government , and vice president al-shara given foreign affairs	N/A	1	1	0-0 1-1 2-2 3-3 4-4 6-9 8-7 9-8 11-10 12-10 14-11 15-12		 
1232:1232	the prosecutor of republican party in house of representative hoped to summons more than 15 persons , including lewinsky , to court .	N/A	the republican prosecutors hope to ask lewinsky and another 15 people to testify in court .	N/A	1	1	0-0 1-2 3-1 4-1 9-3 10-4 11-5 14-9 15-10 18-6 20-11 21-14 22-15 12-8 13-8 21-12 21-13		 
1233:1233	she is suffering from a tumor caused by a kidney disease .	N/A	she has a swelling because of a kidney disease .	N/A	1	1	0-0 4-2 5-3 6-4 7-5 8-6 9-7 10-8 11-9 1-1 2-1 3-1		 
1234:1234	in this way not only is the health of blood donors protected , but the system will also more effectively protect the health and safety of those who need blood .	N/A	this way not only protects blood donors ' health but also more effectively protects blood users ' health and safety .	N/A	1	1	1-0 2-1 3-2 4-3 6-8 7-8 9-5 10-6 11-4 13-9 17-10 18-11 19-12 20-13 22-17 23-18 24-19 26-14 26-15 27-14 27-15 28-14 28-15 29-14 29-15 30-20		 
1235:1235	connie wang was kidnapped along with her personal bodyguard and chauffeur in early july . / end of item /	N/A	she was kidnapped with her personal bodyguard and driver in early june . / ends /	N/A	1	1	2-1 3-2 4-3 5-3 6-4 7-5 8-6 9-7 10-8 11-9 12-10 14-12 15-13 16-14 17-14 18-14 19-15 0-0 1-0 13-11		 
1236:1236	in 1991 , dole was found to have contracted prostate cancer . the doctor said that it had been cured after he received the treatment .	N/A	dole was found the prostate cancer in 1991 , the doctors said he was healed after an operation .	N/A	1	1	0-6 1-7 2-8 3-0 4-1 5-2 9-4 10-5 11-8 12-9 13-10 14-11 19-14 20-15 23-16 24-17 25-18 15-11 16-12 17-13 18-13		 
1237:1237	south and north korea are still technically at war .	N/A	they are still technically at war .	N/A	1	1	4-1 5-2 6-3 7-4 8-5 9-6 0-0 1-0 2-0 3-0		 
