581:581	the united states and north korea planned to have a talk on friday about the on-the-spot examination of a suspected place of underground nuclear facilities near pyongyang .	N/A	u.s. and north korea continued talks on friday about the inspection of a suspected underground nuclear facility near pyongyang .	N/A	1	1	0-0 1-0 2-0 3-1 4-2 5-3 6-4 7-4 8-5 9-5 10-5 11-6 12-7 13-8 14-9 16-10 17-11 18-12 19-13 22-14 23-15 24-16 25-17 26-18 27-19		 
582:582	it was stated that wong was the sister of robert cheng , the proprietor of a company which manufactures plastic furniture and sponge rubber products .	N/A	wong is the sister of robert cheng , owner of a company that manufactures plastic furniture and rubber foam products .	N/A	1	1	4-0 5-1 6-2 7-3 8-4 9-5 10-6 11-7 12-8 13-8 14-9 15-10 16-11 17-12 18-13 19-14 20-15 21-16 22-18 23-17 24-19 25-20		 
583:583	the leaders of peru , bolivia and other countries have all cut their own pay .	N/A	leaders of peru and bolivia both cut their own salaries .	N/A	1	1	0-0 1-0 2-1 3-2 4-3 5-4 10-5 11-6 12-7 13-8 14-9 15-10		 
584:584	the committee said that , gonnavan cited the words of one violated woman in a report published in july .	N/A	the committee said , gunawan quoted a rape victim in an article published in july .	N/A	1	1	0-0 1-1 2-2 4-3 5-4 6-5 7-5 8-5 9-5 13-9 14-10 15-11 16-12 17-13 18-14 19-15 3-2 10-6 11-7 11-8 12-7 12-8		 
585:585	he also promised that he would not neglect the afghan people when the struggle had ended .	N/A	he also promised not to abandon the afghan people after the war ends .	N/A	1	1	0-0 1-1 2-2 6-3 7-4 7-5 8-6 9-7 10-8 11-9 12-10 13-11 15-12 16-13 14-12		 
586:586	the dead and the injured are all passengers from the bus .	N/A	all the dead were passengers of the bus .	N/A	1	1	0-1 1-2 5-3 6-0 7-4 8-5 9-6 10-7 11-8		 
587:587	all equipment needed for the project will be produced and installed completely within this year .	N/A	all the equipments will be produced and installed within this year .	N/A	1	1	0-0 1-1 1-2 6-3 7-4 8-5 9-6 10-7 12-8 13-9 14-10 15-11		 
588:588	to protect the privacy of those seeking consultation , the form for testing can be registered using a code or number .	N/A	to protect the privacy of consulters , test forms can be registered with codes or serial numbers .	N/A	1	1	0-0 1-1 2-2 3-3 4-4 5-5 6-5 7-5 8-6 9-8 10-8 12-7 13-9 14-10 15-11 17-13 18-13 19-14 20-15 20-16 21-17 16-12		 
589:589	he said that the newly-signed documents are very important to the strengthening of good neighborhood relationship and friendly cooperation between the two countries .	N/A	he deemed the just signed documents highly important to strengthen the good neighborliness and friendly cooperation .	N/A	1	1	0-0 3-2 4-3 4-4 5-5 6-6 7-6 8-7 9-8 10-9 11-9 12-9 13-10 13-11 14-12 15-12 16-13 17-14 18-15 23-16 1-1 2-1		 
590:590	turin winter olympic games unveiled , and both north and south korean delegations marched into the stadium together while holding hands	N/A	south and north korean delegations march into stadium together as winter olympics open in turin	N/A	1	1	0-14 1-10 2-11 3-11 4-12 8-2 9-1 10-0 11-3 12-4 13-5 14-6 15-7 16-7 17-8 0-13		 
591:591	according to statistics , from january 1999 to june 2003 , a total of 99 housemaids of various nationalities died after accidentally falling down from buildings .	N/A	data show that from january 1999 to june 2003 altogether 99 housemaids from different countries died from falling off buildings .	N/A	1	1	0-0 0-1 1-0 1-1 2-0 2-1 3-2 4-3 5-4 6-5 7-6 8-7 9-8 11-9 12-9 13-9 14-10 15-11 16-12 17-13 18-14 19-15 20-16 22-17 23-18 24-18 25-19 26-20		 
592:592	he said , " we deployed the necessary individuals in the rural areas and throughout the observation centers on the regional level . "	N/A	" we installed the required personnel in rural regions and monitoring points " , he said .	N/A	1	1	0-14 1-15 2-16 3-0 4-1 5-2 6-3 7-4 8-5 9-6 10-7 11-7 12-8 13-9 22-13 23-12 15-10 15-11 16-10 16-11 17-10 17-11		 
593:593	he called for intensive talks to be held in the next few weeks .	N/A	he called on intensive talks in the next few weeks .	N/A	1	1	0-0 1-1 2-2 3-3 4-4 8-5 9-6 10-7 11-8 12-9 13-10		 
594:594	" the important thing is that the meeting results in a continuation of the -lsb- peace -rsb- process . "	N/A	it is important that the meet should lead to the continuity of the peace process .	N/A	1	1	2-2 4-1 5-3 6-4 7-5 8-7 8-8 9-7 9-8 10-9 11-10 12-11 13-12 15-13 17-14 18-15 1-0 3-0		 
595:595	although the chinese government has issued similar directives a number of times , the resolve to take action this time appears greater than in the past .	N/A	though the chinese government has made such statements several times , this time the decision seems likely to go ahead .	N/A	1	1	0-0 1-1 2-2 3-3 4-4 5-5 7-7 8-8 9-8 10-8 11-9 12-10 13-13 14-14 15-14 16-14 17-14 18-11 19-12 20-15 26-20 21-16 21-17 21-18 21-19 22-16 22-17 22-18 22-19 23-16 23-17 23-18 23-19 24-16 24-17 24-18 24-19 25-16 25-17 25-18 25-19		 
596:596	in 1991 , dole was found to have contracted prostate cancer . the doctor said that it had been cured after he received the treatment .	N/A	dole was diagnosed with prostate cancer in 1991 . the doctor said he is cured after the surgery .	N/A	1	1	0-6 1-7 3-0 4-1 5-2 5-3 6-2 6-3 7-2 7-3 8-2 8-3 9-4 10-5 11-8 12-9 13-10 14-11 16-12 19-14 20-15 23-16 24-17 25-18 17-13 18-13		 
597:597	it is understood that the japanese government and the ruling party hopes the central bank can induce the price level inside japan to inflate at a rate of 1-3 percent a year .	N/A	as reported , the japanese government and ruling party expect the central bank to induce the domestic inflation rate to 1-3 % .	N/A	1	1	2-1 3-1 4-3 5-4 6-5 7-6 8-7 9-7 10-8 11-9 12-10 13-11 14-12 16-14 17-15 24-18 25-18 26-18 27-19 28-20 29-21 32-22 0-0 1-0 15-13 18-16 18-17 19-16 19-17 20-16 20-17 21-16 21-17 22-16 22-17 23-16 23-17		 
598:598	1970 nobel laureate loins lians palling advised using a daily dose of 1,000 mg of the vitamin for protection from colds .	N/A	winner of 1970 nobel prize layence pauling suggested 1000 mg diet daily to avoid cold .	N/A	1	1	0-2 1-3 1-4 2-3 2-4 4-5 5-6 6-7 9-11 12-8 13-9 17-12 17-13 18-12 18-13 19-12 19-13 20-14 21-15 10-10		 
599:599	the value of new contractual investments amounted to 70 million us dollars .	N/A	new contractual investments total 70 million us dollars .	N/A	1	1	3-0 4-1 5-2 6-3 7-3 8-4 9-5 10-6 11-7 12-8		 
600:600	kusai reiterated that thailand will never support any party of cambodia to utilize thailand for any activity in an attempt to subvert the neighboring countries .	N/A	gusa reiterated that thailand would never support any part of cambodia to do any activities of subversion .	N/A	1	1	1-1 2-2 3-3 4-4 5-5 6-6 7-7 8-8 9-9 10-10 11-11 15-13 16-14 17-15 20-16 21-16 25-17 0-0 12-12 13-12 14-12		 
601:601	earlier this week , malaysia foreign minister addullah said that the issue of cambodia 's accession to asean is hinged on whether cambodia can successful form a legitimate government .	N/A	early this week , malaysian foreign minister albar said that whether cambodia could join in asean depended on whether there was a legal government .	N/A	1	1	0-0 1-1 2-2 3-3 4-4 5-5 6-6 7-7 8-8 9-9 16-14 17-15 18-16 19-16 20-17 21-18 26-21 27-22 28-23 29-24 10-10 10-11 10-12 10-13 11-10 11-11 11-12 11-13 12-10 12-11 12-12 12-13 13-10 13-11 13-12 13-13 14-10 14-11 14-12 14-13 15-10 15-11 15-12 15-13		 
602:602	in this lies a measure of credibility which can be built upon in the future . " 1	N/A	in this way it will win some credibility for the future " .	N/A	1	1	0-0 1-1 6-6 6-7 13-9 14-10 15-12 16-11 2-2 2-3 2-4 2-5 7-8 8-8 9-8 10-8 11-8 12-8		 
603:603	she was found hanging from a fan in her room , located in kunjawani near jammu .	N/A	megha was found hanging in her room in kanjwani near jammu .	N/A	1	1	1-1 2-2 3-3 4-3 5-3 6-3 7-4 8-5 9-6 11-7 12-7 13-8 14-9 15-10 16-11 0-0		 
604:604	during a press conference a spokesman for the american presidency , ari fleischer , said : " the al-jazira channel will show this tape during the day . "	N/A	ari fleischer , the american president 's spokesman , said in a press conference : " aljazeera will show this tape today . "	N/A	1	1	0-10 1-11 2-12 3-13 5-7 6-6 7-3 8-4 9-5 10-8 11-0 12-1 13-2 14-9 15-14 16-15 17-16 18-16 19-16 20-17 21-18 22-19 23-20 24-21 25-21 26-21 27-22 28-23 4-7		 
605:605	this was 30 years ago . the news these days , all of which is published and correct , includes :	N/A	that was 30 years ago . today 's news , all published and accurate , includes :	N/A	1	1	0-0 1-1 2-2 3-3 4-4 5-5 6-8 7-8 10-9 11-10 12-10 13-10 14-10 15-11 16-12 17-13 18-14 19-15 20-16 8-6 9-6		 
606:606	this commission said that , despite the turbulent situation outside of the region , regional economics appeared comparatively well .	N/A	the committee said the region 's economic performance is relatively good despite external shocks .	N/A	1	1	0-0 1-1 2-2 5-11 6-13 7-13 8-13 11-3 12-4 15-6 16-8 17-9 18-10 19-14 3-2 9-12 10-12 11-12 12-12		 
607:607	dole once attend a discussion program , and claimed in parliament to appeal his countrymen to diagnosis and treat prostate cancer in its early stage and understand its side effect - impotence .	N/A	dole had been on a discussion program and urged citizens to diagnose and treat prostate cancer and realize its side-effect , impotence .	N/A	1	1	0-0 3-4 4-5 5-6 7-7 11-10 12-8 15-10 16-11 17-12 18-13 19-14 20-15 25-16 26-17 27-18 28-19 29-19 31-21 32-22 1-1 2-2 2-3 13-9 14-9 30-20		 
608:608	we respect and honor pakistan 's sacrifices against terrorism and extremism .	N/A	we hail pakistan 's sacrifices against terrorism and extremism .	N/A	1	1	0-0 1-1 2-1 3-1 4-2 5-3 6-4 7-5 8-6 9-7 10-8 11-9		 
609:609	yesterday the rain cleared for a while , but most districts of mumbai were still completely flooded today .	N/A	the rains eased yesterday , although most areas around mumbai were still flooded today .	N/A	1	1	0-3 1-0 2-1 3-2 7-4 8-5 9-6 10-7 11-8 12-9 13-10 14-11 16-12 17-13 18-14		 
610:610	peace in the middle east is consistent with the wishes of the peoples of both israel and palestine for peaceful and secure coexistence .	N/A	middle east peace meets the desire of the israelis and palestinians to coexist in peace and security .	N/A	1	1	0-2 2-0 3-0 4-1 5-3 6-3 7-3 8-4 9-5 10-6 11-7 15-8 16-9 17-10 18-13 19-14 20-15 21-16 22-11 22-12 23-17		 
611:611	taliban regime is acting against the interest of afghanistan and afghani people by refusing to bring usama bin laden and his followers before justice " , the statement said .	N/A	the taliban regime is hurting afghanistan and the afghani people by protecting osama bin laden and his associates from justice . "	N/A	1	1	0-0 0-1 1-2 2-3 3-4 4-4 5-4 6-4 7-4 8-5 9-6 10-7 10-8 11-9 12-10 16-12 17-13 18-14 19-15 20-16 21-17 22-18 23-19 24-21 29-20 13-11 14-11 15-11		 
612:612	no human has ever been infected with the virus .	N/A	no humans were infected with the virus .	N/A	1	1	0-0 1-1 5-3 6-4 7-5 8-6 9-7 2-2 3-2 4-2		 
613:613	india news agency and hindustan times reported that officials of the railway department accuse the passengers of the bus for the accident .	N/A	the press trust of india reported that railway officials blamed the passengers for the accident .	N/A	1	1	0-3 0-4 1-0 1-1 1-2 2-0 2-1 2-2 3-0 3-1 3-2 4-0 4-1 4-2 5-0 5-1 5-2 6-5 7-6 8-8 10-7 11-7 12-7 13-9 14-10 15-11 19-12 20-13 21-14 22-15		 
614:614	the minister of defense once addressed that about 20,000 soldiers were missing during the war , and the minister of defense believed that some of them were still alive .	N/A	the defense ministry said about 20,000 soldiers were missing in the korean war and it believed that some had survived .	N/A	1	1	0-0 1-2 2-1 3-1 4-3 5-3 6-3 7-4 8-5 9-6 10-7 11-8 12-9 13-10 14-11 14-12 16-13 21-15 22-16 23-17 24-17 25-17 26-18 27-19 28-19 29-20 17-14 18-14 19-14 20-14		 
615:615	the asteroid brushed by the earth on march 8 , but by the time it was discovered on march 12 , the asteroid had gone far away .	N/A	the asteroid passed by the earth on march 8 , but was discovered on march 12 when it was gone .	N/A	1	1	0-0 1-1 2-2 3-3 4-4 5-5 6-6 7-7 8-8 9-9 10-10 15-11 16-12 17-13 18-14 19-15 23-18 24-19 27-20 11-16 12-16 13-16 21-17 22-17		 
616:616	commercial stores will be granting discounts ranging from 10 to 50 per cent , and hotels are going to charge half their normal rates .	N/A	shops will offer 10 to 50 percent discounts and hotels will charge half their normal rates .	N/A	1	1	0-0 1-0 2-1 3-2 4-2 5-7 8-3 9-4 10-5 11-6 12-6 14-8 15-9 16-10 17-10 18-10 19-11 20-12 21-13 22-14 23-15 24-16		 
617:617	shiashong said that , even if the cambodian opposition groups could put together a combined government before the upcoming summit meeting , it will not automatically become a member of the asian pacific security committee .	N/A	mr. siazon saild that even if philippines antagonist groups could form a coalition government before the summit , it would 't become member of asean spontaneously .	N/A	1	1	0-0 0-1 1-2 2-3 4-4 5-5 9-8 10-9 11-10 12-10 13-11 14-12 15-13 16-14 17-15 19-16 20-16 21-17 22-18 23-19 24-20 25-25 26-21 27-22 28-22 29-23 30-24 31-24 32-24 33-24 34-24 35-26 6-6 6-7 7-6 7-7 8-6 8-7		 
618:618	some are proposing an indictment against him and some want him to resign on his own . to make the situation worst , many democrats in congress also want a clear line with him .	N/A	some want to impeach him or expect him to step down . even some democratic congressmen want to make a clean break with him .	N/A	1	1	0-0 3-3 4-3 5-3 6-4 7-5 9-6 10-7 11-8 12-9 12-10 13-9 13-10 14-9 14-10 15-9 15-10 16-11 23-13 24-14 24-15 25-14 25-15 26-14 26-15 28-16 28-17 28-18 29-19 30-20 31-21 32-22 33-23 34-24 1-1 1-2 2-1 2-2 17-12 18-12 19-12 20-12 21-12 22-12		 
619:619	in face of this situation , the customs has always taken tight monitoring measures such as frequent checks and careful inspection so as to effectively prevent the outflow of domestic currencies .	N/A	facing the situation , the customs has been taking tight monitoring measures to carry out careful checks to prevent the outflow of currencies .	N/A	1	1	0-0 1-0 2-0 3-1 4-2 5-3 6-4 7-5 8-6 10-8 11-9 12-10 13-11 17-16 19-15 21-17 22-17 23-17 25-18 26-19 27-20 28-21 30-22 31-23 9-7		 
620:620	doha stopped its progress in its relations with israel after the coming of benyamin netanyahoo to power in 1996 .	N/A	doha broke of relations with israel after benjamin netanyahu came to power in 1996 .	N/A	1	1	0-0 1-1 1-2 2-1 2-2 3-1 3-2 4-1 4-2 6-3 7-4 8-5 9-6 10-9 11-9 12-9 13-7 14-8 15-10 16-11 17-12 18-13 19-14		 
621:621	nastase conceded defeat and offered his congratulations to basescu .	N/A	nastase conceded defeat and congratulated basescu .	N/A	1	1	0-0 1-1 2-2 3-3 4-4 5-4 6-4 7-4 8-5 9-6		 
622:622	i can name you over 10 countries just from my memory . in addition , i believe there will be more countries showing their support soon . "	N/A	i can name over ten countries just by memory , and i think more countries will show their support . "	N/A	1	1	0-0 1-1 2-2 4-3 5-4 6-5 7-6 8-7 10-8 11-9 12-10 13-10 15-11 16-12 18-15 19-13 20-13 21-14 22-16 23-17 24-18 26-19 27-20		 
623:623	the leaders of the schools in flood-stricken area automatically went to work in advance , to clean up the school facilities carefully , sanitize , and repair the damaged or destroyed school buildings .	N/A	school leaders and staff in the disaster areas go to school earlier than usual to clean up and do sterilization and repair jobs by themselves	N/A	1	1	0-1 1-1 3-0 4-0 5-4 7-7 9-8 10-9 11-10 12-11 12-12 12-13 13-11 13-12 13-13 15-14 16-15 17-16 22-17 23-18 23-19 25-20 26-21 6-5 6-6 8-23 8-24 27-22 28-22 29-22 30-22 31-22 32-22		 
624:624	however , several members of the u.s. house of representatives present in buenos aires say that they object to the clinton administration taking any such action .	N/A	however , some us congressmen in buenos aires said they opposed any such actions taken by the clinton administration .	N/A	1	1	0-0 1-1 2-2 3-4 5-3 6-3 7-4 8-4 9-4 10-5 11-5 12-6 13-7 14-8 16-9 17-10 18-15 19-16 20-17 21-18 22-14 23-11 24-12 25-13 26-19 15-8		 
625:625	this scandal was widely reported and republished by large and small media across china . the news is most gratifying to the vast majority of compatriots .	N/A	this scandal is covered or reprinted by chinese media , large or small , to the immense gratification of the compatriots .	N/A	1	1	0-0 1-1 2-2 3-3 4-3 5-4 6-5 7-6 8-10 9-11 10-12 11-8 12-7 13-7 18-16 19-17 21-16 22-16 23-16 24-18 25-19 25-20 26-21		 
626:626	angham will headline another concert on wednesday night as part of the 34th international hamamat festival .	N/A	angham will also be singing on wednesday at the 34th hamamat international festival .	N/A	1	1	0-0 1-1 4-4 5-5 6-6 8-7 9-7 10-7 11-8 12-9 13-11 14-10 15-12 16-13 2-2 2-3 3-2 3-3		 
627:627	the japanese prime minister junichiro koizumi is accused by the japanese media as overstatement on his " educational background " of " studying in london for 2 years " .	N/A	japanese media revealed that prime minister junichiro koizumi 's " academic record " of " two years study in london " is an exaggeration .	N/A	1	1	2-4 3-5 4-6 5-7 9-0 10-0 11-1 12-21 12-22 12-23 13-21 13-22 13-23 15-8 16-9 17-10 18-11 19-12 20-13 21-14 22-17 23-18 24-19 26-15 27-16 28-20 29-24 6-2 6-3 7-2 7-3 8-2 8-3		 
628:628	the mainland economy will grow steadily in the long term and hong kong 's economy will benefit from the mainland economy which is full of vitality .	N/A	the economy of hong kong will benefit from the long-term and steady growth of the thriving economy of the inland .	N/A	1	1	0-18 1-19 2-16 4-12 5-11 7-8 8-9 9-9 10-10 11-3 12-4 13-2 14-0 14-1 15-5 16-6 17-7 18-18 19-19 20-16 23-15 24-15 25-15 26-20		 
629:629	it should be mentioned that hong kong disneyland opened its doors to the public in september 2005 .	N/A	hong kong disneyland opened its doors to the public in september 2005 .	N/A	1	1	5-0 6-1 7-2 8-3 9-4 10-5 11-6 12-7 13-8 14-9 15-10 16-11 17-12		 
630:630	the " forces for national liberation , " the seventh rebel forces group , refused to sign the peace agreement .	N/A	the 7th rebellious organization " fnl " refused to sign the peace accord .	N/A	1	1	1-4 2-5 3-5 4-5 5-5 7-6 8-0 9-1 10-2 11-3 12-3 14-7 15-8 16-9 17-10 18-11 19-12 20-13		 
631:631	leothal made the comment when he was speaking with a radio reporter in paris .	N/A	leotard said this to a radio station reporter in paris .	N/A	1	1	0-0 7-1 8-3 9-4 10-5 10-6 11-7 12-8 13-9 14-10		 
632:632	shall we attempt to salvage the agreement , or shall we announce that the agreement has fatal flaws and should be discussed anew .	N/A	to try to save it , or to announce that the protocol has fatal drawbacks which needs re-discussion . "	N/A	1	1	2-0 2-1 3-2 4-3 7-5 8-6 11-8 12-9 13-10 14-11 15-12 16-13 17-14 19-16 20-16 21-17 22-17 23-18 5-4 6-4 9-7		 
633:633	all circles of the society have also lent a helping hand to him .	N/A	he was offered help from all walks of life .	N/A	1	1	0-5 1-6 2-7 3-8 4-8 7-2 7-3 8-2 8-3 9-2 9-3 10-2 10-3 12-0 13-9		 
634:634	in last year , there were 583 defections , which set a new record for the country .	N/A	last year , a record number of 583 persons fled to rok .	N/A	1	1	1-0 2-1 3-2 6-7 7-8 11-3 13-4 17-12 0-0 7-9 7-10 7-11		 
635:635	he explained that he is looking forward to meeting president assad to " talk to him and work with him to continue making progress . "	N/A	he also said he would try to meet president hafez al-assad " to talk and work toward further progress . "	N/A	1	1	0-0 1-2 2-2 3-3 4-4 4-5 5-4 5-5 6-4 6-5 7-6 8-7 9-8 10-9 10-10 11-12 12-11 13-13 16-14 17-15 20-16 21-17 23-18 24-19 25-20		 
636:636	it is estimated that the development of the first two land sections can be finished by march 2000 .	N/A	the first two locations are estimated to be finished by march , 2000 .	N/A	1	1	1-4 2-5 7-0 8-1 9-2 10-3 11-3 13-7 14-8 15-9 16-10 17-12 18-13 12-6		 
637:637	the winner received three gold medals from the local officials in the tourism sector .	N/A	the winner received 3 gold medals from local tourism officials .	N/A	1	1	0-0 1-1 2-2 3-3 4-4 5-5 6-6 8-7 9-9 10-8 11-8 12-8 13-8 14-10		 
638:638	the amount of actually utilized foreign capital also increased more than 30 % over the same period of last year .	N/A	the actual foreign funds increased by 30 % over the same period last year .	N/A	1	1	0-0 1-1 2-1 3-1 4-1 5-2 6-3 8-4 9-5 10-5 11-6 12-7 13-8 14-9 15-10 16-11 17-12 18-12 19-13 20-14		 
639:639	sasar said that aladas once promised to decrease gradually the indonesian troops stationed in east timor .	N/A	saiser said alatas had promised to gradually reduce indonesian troops in east timor .	N/A	1	1	0-0 1-1 3-2 4-3 5-4 6-5 7-7 8-6 9-8 10-8 11-9 13-10 14-11 15-12 16-13 2-2 12-10		 
640:640	egypt was the first stage in santer 's tour of the middle east , which aims at reinforcing the role of europe in the peace process .	N/A	egypt was the first leg of this tour intended to enhance the european role in the peace process .	N/A	1	1	0-0 1-1 2-2 3-3 4-4 5-5 8-7 15-8 15-9 16-8 16-9 17-10 18-11 19-13 20-12 21-12 22-14 23-15 24-16 25-17 26-18 6-6 7-6		 
641:641	the seven astronauts , who were receiving training last week at valcartier military base near quebec city in canada , have finished their training and returned to the united states .	N/A	in last week , seven astronauts finished their training at valcartier military base near quebec city and had returned to united states .	N/A	1	1	1-4 2-5 8-1 9-2 10-9 11-10 12-11 13-12 14-13 15-14 16-15 21-6 22-7 23-8 24-16 25-18 26-19 27-20 28-20 29-21 30-22 25-17		 
642:642	al-mandari was accused in several cases in france in the context of a smuggling affair of counterfeit dinars in bahrain valued at about 350 million euros .	N/A	mandari had been indicted for several cases in france for trafficking false dinars in bahrain , estimated at 350 million euros .	N/A	1	1	0-0 2-3 2-4 3-3 3-4 4-5 5-6 6-7 7-8 8-9 9-9 10-9 11-9 12-10 13-10 14-10 15-10 16-11 17-12 18-13 19-14 20-16 21-17 22-18 23-18 24-19 25-20 26-21 1-1 1-2		 
643:643	furthermore , there will be the showing of ten films that will stress the traditional fine arts and architecture , skills and modern life in japan .	N/A	in addition , ten films will be shown focusing on the beautiful traditional artworks , skills and modern life in japan .	N/A	1	1	0-0 0-1 1-2 3-5 4-6 5-7 6-7 7-7 8-3 9-4 10-8 10-9 11-8 11-9 12-8 12-9 13-10 14-12 15-13 16-13 17-13 18-13 19-14 20-15 21-16 22-17 23-18 24-19 25-20 26-21		 
644:644	the european envoy stated that all the parties " wanted to get out of this stagnation " which the peace process had fallen into .	N/A	the european envoy said all parties " want this impasse in the peace process to end . "	N/A	1	1	0-0 1-1 2-2 3-3 5-4 6-5 7-5 8-6 9-7 10-14 14-8 15-9 16-17 18-11 19-12 20-13 24-16 11-15 12-15 13-15		 
645:645	wang , who is also a member of the central military command , said that china and chile have long-standing amicable relations in spite of the geographical distance between the two countries .	N/A	the two peoples of china and chile have old friendly relations despite the geographic distance between the two countries , wang said .	N/A	1	1	0-20 13-21 15-4 16-5 17-6 18-7 19-8 20-9 21-10 22-11 23-11 24-11 25-12 26-13 27-14 28-15 29-16 30-17 31-18 32-22		 
646:646	however , if he is found guilty , he should be punished in the same way as any other malaysian citizens .	N/A	but if he is guilty , he should receive the punishment like other malay citizens " .	N/A	1	1	0-0 2-1 3-2 4-3 5-4 6-4 7-5 8-6 9-7 10-8 10-9 10-10 11-8 11-9 11-10 12-11 13-11 14-11 15-11 16-11 17-12 18-12 19-13 20-14 21-16		 
647:647	among the 517 polled , only 20.6 % were willing to call themselves chinese , and 1.6 % did n't give a definitive answer definitely , nor did they express any opinion on the issue .	N/A	of the 517 people interviewed , only 20.6 % called themselves chinese , while 1.6 % had no clear answer or gave no opinions .	N/A	1	1	0-0 1-1 2-2 3-4 4-5 5-6 6-7 7-8 11-9 12-10 13-11 14-12 15-13 16-14 17-15 18-16 19-17 22-18 23-19 26-20 29-21 30-22 31-23 35-24		 
648:648	publication and distribution of " speeches , investigations and study papers by mao zedong , zhou enlai , liu shaoqi , zhu de , deng xiaoping and chen yun "	N/A	publication of on investigations and studies by mao zedong , zhou enlai , liu shaoqi , zhu de , deng xiaoping , and chen yun	N/A	1	1	0-0 3-1 7-3 8-4 9-5 10-5 11-6 12-7 13-8 14-9 15-10 16-11 17-12 18-13 19-14 20-15 21-16 22-17 23-18 24-19 25-20 26-22 27-23 28-24		 
649:649	below is an interview report on the press conference on the same day from voa correspondent zhou youkang	N/A	the following is a spot coverage by voa correspondent zhou youkang at the conference .	N/A	1	1	0-0 0-1 1-2 2-3 3-4 4-5 5-11 6-12 7-13 8-13 13-6 14-7 15-8 16-9 17-10		 
650:650	soya had been abducted with her personal bodyguard and driver at the beginning of june . / end of the news item / 1	N/A	she was kidnapped with her personal bodyguard and driver in early june . / ends /	N/A	1	1	3-2 4-3 5-4 6-5 7-6 8-7 9-8 10-9 11-10 12-10 13-10 14-11 15-12 16-13 22-15 0-0 1-1 2-1 17-14 18-14 19-14 20-14 21-14		 
651:651	the disease has caused the deaths of five people in vietnam .	N/A	the disease killed five people in vietnam .	N/A	1	1	0-0 1-1 2-2 3-2 4-2 5-2 6-2 7-3 8-4 9-5 10-6 11-7		 
652:652	his recordings of all 23 of beethoven 's sonatas received great acclaim and were famous throughout europe .	N/A	his recording of bethoven 's 32 sonatas is widely successful and renowned in europe .	N/A	1	1	0-0 1-1 2-2 6-3 7-4 8-6 12-10 14-11 15-12 16-13 17-14 4-5 9-7 9-8 9-9 10-7 10-8 10-9 11-7 11-8 11-9		 
653:653	it is estimated that the development of the first two land sections can be finished by march 2000 .	N/A	the development of first two sections should be completed by march 2000 .	N/A	1	1	4-0 5-1 6-2 7-3 8-3 9-4 10-5 11-5 12-6 13-7 14-8 15-9 16-10 17-11 18-12		 
